"标题","正文"
"郑眼看盘：美联储加息 A股平和应对","摘要            本周四A股小跌，沪综指收挫0.32%至3292.44点，其余股指略微好一些但相差不大，市场成交额略有放大。市场波幅没有放大，但成交额有所放大，这放在平时不一定是好事，但周四情况特殊，不能说明什么问题。总的来看，A股昨天的表现相对比较平和。                             　　本周四A股小跌，沪综指收挫0.32%至3292.44点，其余股指略微好一些但相差不大，市场成交额略有放大。市场波幅没有放大，但成交额有所放大，这放在平时不一定是好事，但周四情况特殊，不能说明什么问题。总的来看，A股昨天的表现相对比较平和。　　美联储隔夜宣布加息，“点阵图”暗示明年有可能再加息三次，后年是两次。由于美联储内部委员之间的分歧有所加大，加上美联储主席耶伦表态并不强硬，故这次利率会议被多数人认为“略微偏软”。　　因联系汇率制度，我国香港当即跟进加息，幅度也是25个基点。内地市场反应暂不明显，资金市场利率略有上升。可能正是因为利率变动，这才造成了偏鸽的美联储加息并未明显推动A股上涨。　　昨央行进行了本月第二次MLF续做，且进行了逆回购操作，几乎所有品种的中标利率都微幅上行了5个基点，与美联储加息25基点相去甚远，所以这种变动应属相当细微。然而，市场可能更看重其信号意义，这可能造成周四部分A股投资者谨慎情绪趋浓。　　我曾担心美联储加息的相关消息可能爆冷，认为A股短期波动有放大可能。然而事后看，市场是有惊无险的。不过，个人觉得美联储加息仍有后续影响，只是一时不太明朗。　　美联储预期明年会加息三次，但其实美国通胀及薪资情况不一定支持加息这么多次，除非税改效果极好。至于未来美国减税到底造成何种影响，这得看其增加的税基能否跟得上财政赤字的扩张，还得看全球其他主要国家是否在贸易与税收方面与美国强力竞争。　　如果参与竞争的国家多了，美国减税目的或许就会落空，反之美国经济就可能表现得更好。在那种较顺利的情况下，美联储明年加息三次甚至更多的机会就不能排除了。　　这些事一时是看不出来的，明显需要时间验证，所以投资者可能很难预设立场。考虑到美联储即使不能于明年加息三次，那加息两次仍是很可能的。所以个人认为，我国的利率水平早晚还将趋升，这至少会对明年上半年的A股构成些压制。　　今晨投资者可顺便看下欧央行、英央行动向，然后或可稍稍修正之前观点。就一般操作来说，我仍建议投资者在年末时段谨慎一些，以控制仓位为主。很明显，就现今内外部金融形势来说，许多事情至少还需观察一阵，多看少动为宜。                                    (原标题：郑眼看盘：美联储加息 A股平和应对)                                                (责任编辑：DF372)"
"谈股说债：A股短期难现单边牛市","摘要            11月制造业PMI指数较上月回升0.2个百分点至51.8%，并明显高于市场普遍预期的51.4%。市场预期11月PMI向下，但PMI实际向上。                             　　11月制造业PMI指数较上月回升0.2个百分点至51.8%，并明显高于市场普遍预期的51.4%。市场预期11月PMI向下，但PMI实际向上。　　严格意义上，市场普遍预期PMI回落，主要因为11月部分行业的确有出现生产收缩的现象。进入采暖季以来，部分行业因环保等因素限产、停产，全国高炉开工率、6大集团发电耗煤等高频指标均出现明显回落。全国高炉开工率由10月底的71.1%大幅回落至12月初的63.1%，已降至近年来新低。6大发电集团日均耗煤量同比增速也由10月底的16.5%大幅回落至11月底的1.9%。因此，市场对11月制造业PMI指数的预期偏淡。　　然而，问题在于制造业采购经理人指数并非对真实经济生产的统计，而是一种景气调查指数。PMI指数包含新订单、产量、雇员、供应商配送、库存、价格、积压订单、新出口订单、进口等商业活动指标。各项指标指数基于对样本企业采购经理的月度问卷调查所得数据合成得出。被调查者对每个问题只需做出定性的判断，在(比上月)上升、不变或下降三种答案中选择一种。　　采购经理人往往依据当前的生产情况判断景气程度。因此，在绝大多数时间内，企业的实际生产状况与企业采购经理人的判断一致，即制造业PMI与高频工业经济数据保持同向运动。回溯历史，制造业PMI与高频工业经济数据的背离也时而存在。例如，去年采暖季开始前，受到非经济因素的干扰，同样出现了高频工业经济数据回落而制造业PMI回升的情况。本次理应受限产影响较大的黑色金属行业PMI不降反升，较上月回升0.8个百分点至53.1%。受到非经济因素干扰，虽然实际生产受限，但经济需求并未真实恶化。因此，采购经理人对经济景气程度的判断是乐观的。黑色金属新订单指数较上月明显回升9.5个百分点至65.4%，显示需求仍相对强劲。　　从主要分项指标来看，生产指数较上月回升0.9个百分点至54.3%，新订单指数较上月回升0.7个百分点至53.6%，均明显改善。这表明企业真实生产受11月下半月开始的“2+26”限产影响，部分行业的生产活动有所限制，但采购经理对生产活动依然乐观。这进一步表示，当前高频经济数据出现的收缩更多是受到政策等非经济因素干扰影响，经济自身的韧性仍然较强。　　近期A股市场大小盘风格出现明显分化，中证500指数向下调整，上证50与沪深300指数表现依然较强。笔者认为，当前市场的结构性差异表现符合基本面状况。在经济维持不悲观叠加通胀抬升货币中性的环境下，市场难以形成单边牛市，更多将呈现指数振荡，行情在内部结构性中演绎。　　(作者单位：长江期货)                                            (责任编辑：DF306)"
"上证50标的股成为融资客最大抛售对象！","摘要            【涨多了就抛！上证50标的股成为融资客最大抛售对象！】交易所数据显示，12月5日，沪深两市融资余额单日下降133.72亿元，创10月份以来最大单日降幅。资金流向方面，虽然以上证50为代表的大盘蓝筹股股价依旧坚挺，但高风险偏好的融资资金却开始呈现逢高了结迹象。（上海证券报）                             最新价：2415.91涨跌额：-24.41涨跌幅：-1.00%成交量：2094万手成交额：269.17亿元换手率：0.13%上证50行情??领涨个股??大盘资金流向??7*24小时快讯??进入上证50吧领涨行业1、煤炭采选涨幅：2.54%上涨：32家下跌：2家领涨股：平庄能源涨幅：10.06%2、港口水运涨幅：0.76%上涨：17家下跌：9家领涨股：长航凤凰涨幅：10.09%　　点击查阅>>>融资融券　　涨多了就抛！上证50标的股成为融资客最大抛售对象！　　交易所数据显示，12月5日，沪深两市融资余额单日下降133.72亿元，创10月份以来最大单日降幅。资金流向方面，虽然以上证50为代表的大盘蓝筹股股价依旧坚挺，但高风险偏好的融资资金却开始呈现逢高了结迹象。　　12月5日，沪深两市有31只个股单日遭融资净卖出1亿元以上，上证50标的占据了其中的16席，保险、银行、基建板块成为资金流出的集中区域。中国平安、中国人寿、中国太保、新华保险4只保险股融资余额均出现下降，其中中国平安单日遭融资净卖出7.27亿元，高居首位。　　中国平安今年以来市场表现抢眼，股价自5月份进入快速上涨通道，涨势一直延续至11月末，其间最大涨幅达120%，并于11月22日升至79.96元的历史新高。与此同时，融资资金也加速涌入中国平安，个股融资余额从5月初的不到120亿元增至11月22日的188亿元，增幅超过60%。　　然而，中国平安股价自11月22日升至新高后出现回落，在接下来的8个交易日内回撤近15%。值得注意的是，融资资金此时反而加快了入场节奏。12月1日，中国平安融资余额增至202.57亿元，融资盘占流通市值比例达到2.75%，刷新近7个月新高，显示大量杠杆资金正选择在中国平安高位回调之际蜂拥买入，以博取后续股价反弹时的短线差价。　　之后的数据变化证实了这一猜测。12月4日、5日，中国平安股价连续两日反弹，累计涨幅5.3%。与此同时，个股融资余额出现大量净偿还，两日累计下降7.72亿元。至此，中国平安融资余额与个股股价之间的关系从前期的“量价齐升”转为“反向变动”，个股背后的资金面正悄然发生改变。　　除了中国平安之外，中信证券、兴业银行、中国建筑等大盘蓝筹股也在12月5日股价强势上涨的同时，单日融资净卖出高达2亿元以上。　　另一方面，在12月5日两市融资余额大幅下降的背景下，部分中小盘科技股获资金逆势流入，近期活跃的芯片、5G等科技题材成为资金关注的重点。　　停牌长达一年半的中环股份于11月29日公告复牌，股价先是收获连续两个一字涨停，此后展开高位震荡，并吸引了大量融资资金涌入。12月1日至12月5日，中环股份融资余额在短短3个交易日内从5.83亿元暴增至13.50亿元，增幅达132%。　　申万宏源研报表示，近年来，芯片制程技术及高端电子产品不断发展，半导体大硅片国产化需求迫切。中环股份作为我国半导体材料行业龙头企业，近期公告开发集成电路大硅片项目，有望填补国内空白。　　此外，5G概念的光迅科技虽然在12月5日股价大跌5.96%，却获融资逆势净买入9983万元。兆驰股份、顺网科技、卫士通等均在股价下跌的同时，获融资净买入2000万元以上。 　　相关报道>>>　　两融余额四连降 15股杠杆资金大幅加仓！　　两融余额仍超万亿 场外资金对后市仍有期待                                            (责任编辑：DF010)"
"国信证券预判2018年是长牛起点","摘要            【国信证券预判2018年是长牛起点】国信证券燕翔认为，结构性持续慢牛行情刚刚开始，2018年A股将在曲折中缓慢上行。明年的投资主线建议重点关注四大领域投资机会：“2B端”、消费升级、产业升级、进口替代。(证券时报)                             最新价：2742.39涨跌额：-25.63涨跌幅：-0.93%成交量：12357万手成交额：1257.32亿元换手率：0.37%上证指数行情??领涨个股??大盘资金流向??7*24小时快讯??进入上证指数吧领涨行业1、煤炭采选涨幅：2.54%上涨：32家下跌：2家领涨股：平庄能源涨幅：10.06%2、港口水运涨幅：0.76%上涨：17家下跌：9家领涨股：长航凤凰涨幅：10.09%　　 明日，“中证国信价值指数”将正式上市。这是国信证券携手中证指数有限公司合作开发的指数，选择了100家连续三年净资产收益率高于10%、且估值合理的上市公司作为样本，并进行等权配置。　　昨日，国信证券经济研究所策略分析师燕翔接受记者采访时表示，该指数区别于其他指数的特点有：一是，选择在给定高净资产收益率的前提下估值最低的股票；二是，指数对100个样本进行等权配置，而不用市值加权配置，可以尽量避免金融股市值权重过大等问题。　　国信证券发布价值指数　　目前，市场中的股票指数主要有综合性指数、行业类指数和量化型指数等。　　中证国信价值指数是一个拥有“投资理念”的股票指数。国信证券表示，从长期来看，股票价格上涨的斜率最终取决于企业的净资产收益率。基于这样的投资理念，选择了100家连续三年净资产收益率高于10%、且估值合理的上市公司作为样本，并进行等权配置。　　从指数的构建方法来看，中证国信价值指数有以下三大条件：一是要求标的上市公司连续三年净资产收益率都高于10%。二是选择在给定高净资产收益率的前提下估值最低的股票，避免“估值陷阱”。三是剔除净资产收益率连续下滑的样本，规避业绩大幅下行的风险，同时对100个样本进行等权配置。　　长牛起点：　　2018年曲折上行　　昨日，在2018年投资策略会上，国信证券经济研究所宏观分析师董德志表示，中国在2009年之前的资本持续扩张，劳动力贡献在逐渐下降，而效率要素一直没有形成有力的支撑。但从日本、德国、美国的经验看，技术创新提高效率，效率催升股指空间。　　而投资策略方面，燕翔认为，结构性持续慢牛行情刚刚开始，2018年A股将在曲折中缓慢上行。明年的投资主线建议重点关注四大领域投资机会：“2B端”、消费升级、产业升级、进口替代。　　具体到行业配置，“2B端”有三个落脚点：基础设备(高端装备、环保系统)，管理系统(软件系统、信息服务)和技术创新(军民融合、科创平台)。　　消费升级方面，医疗、金融保险、娱乐等新兴服务业规模将进一步扩大，总量机会和结构性机会并存。　　产业升级方面，创新驱动的产业升级对资本市场来说会提供源源不断的投资机会，5G、新材料、新能源汽车、人工智能等科技前沿领域逐渐看到了中国企业的身影。　　在进口替代方面，重点产品领域包括石化产品、机械设备(大飞机)、精密仪器(医疗器械)、电子产品和汽车及零部件。　　相关报道>>>　　国信证券：明年市场主攻“补短板” 上涨依赖盈利增长　　国信证券：2018年重点关注消费升级等四大领域投资机会　　畅想2018>>>　　券商研报畅想2018年A股攻略 新能源汽车板块或成开路先锋　　3分钟看完12家券商2018年A股攻略：应该超配股票（最全整理）　　明年A股能到4000点？买什么？听听券商们怎么说　　后市攻略>>>　　招商证券：预计沪指2018年上涨15% 聚焦四大投资主线　　华泰证券2018年度策略：盈势利导 制造牵牛 　　国金证券2018年A股策略：指数先抑后扬 整体趋势向好 　　国泰君安2018投资策略：敢于乐观新驱动、新结构、新高度 　　方正证券2018年度策略会：新时代新周期 战略看多A股结构性牛市 　　华创证券农业行业2018年度投资策略：超配行业龙头 静待养殖链反转                                     (原标题：中证国信价值指数明日上市 国信预判2018年是长牛起点)                                                (责任编辑：DF353)"
"道达投资手记：后市反弹一触即发？","摘要            昨天的行情，极富戏剧性！沪指低开低走，一度大跌近50点，最低跌至3254.61点。然而，就在大家开始感觉有些绝望时，市场迎来“V型”反转。最终，沪指仅小跌9.72点，以3293.97点报收，沪指日线收出带长下影线的阳十字星。                             　　昨天的行情，极富戏剧性！沪指低开低走，一度大跌近50点，最低跌至3254.61点。然而，就在大家开始感觉有些绝望时，市场迎来“V型”反转。最终，沪指仅小跌9.72点，以3293.97点报收，沪指日线收出带长下影线的阳十字星。　　值得注意的是，昨天创业板市场提前止跌，最终反弹1.46%。经过前期市场快速调整之后，盘中A股最后一块“遮羞布”也被扯掉。大盘的反转，是否意味着反弹行情已经一触即发？　　前天，达哥在文章中说过，A股市场就还剩下沪指3300点这最后一块遮羞布了。而昨天，沪指跳空低开12个点，3300点直接告破，接下来的行情，确实是有点惨不忍睹。　　然后有句话说得好“不在沉默中死亡，就在沉默中爆发”。很快，多头发起了猛烈进攻。最终，沪指虽然没能收复3300点，但尾市40分钟时间，沪指从3254点回升到3293.96点，反弹了近40点回来。而沪指算是力度相对较弱的，创业板指数反转更强，最终创业板指数大涨1.46%，一举重新站上5日均线。　　从个股看，虽然沪指下跌，但沪市900多只个股上涨，仅300多只下跌，深市则有1400多只个股上涨，403只个股下跌。更为重要的是，在行情反弹过程中，昨天热点板块再次出现。半导体、芯片概念股成为最强的板块。如士兰微、苏州固锝、聚灿光电、台基股份、上海贝岭、振华科技等多只个股涨停。另外，经过前期持续大跌之后，次新股昨天也大面积复苏，最终深次新股指数昨日大涨2.49%。　　应该说，从沪指11月23日大跌到昨天，经过一段时间的持续下跌之后，昨天尾市的盘面，重新让人看到了“温度”。而经过昨天大盘的“V型”反转，是否意味着新一轮反弹行情一触即发？　　对于昨天中小创个股的反弹，我个人认为，这是物极必反，毕竟之前确实跌得太多了，自然会有技术性反弹出现。而昨天早上，在沪指持续大跌的时候，其实创业板市场已经率先止跌企稳，虽然下午开盘后跟随大盘有过一阵杀跌，但是尾盘的拉升，确实还是比较提升市场人气。不过对于创业板未来的走势，我认为暂时还是当做反弹来看。　　另外，中小盘题材股是否能够集体走强，也还存在疑问。昨天，虽然两市跌停个股大大减少，但是“闪崩”的情况依然出现。继前天多只个股闪崩“过后，昨天浪莎股份出现连续第二个”一字板“跌停。据报道，该公司连续19年不分红，被投资者称之为”铁公鸡“。此外，摩恩电气、卓郎智能两家公司也出现股价”闪崩。所以，就个股层面，我认为未来即便大盘止跌反弹，但有些个股风险还是要警惕。　　最后，关于大盘，我认为沪指昨天收出带长下影线的阳十字星之后，未来只要能够迅速回补昨天的向下跳空缺口，并且重新站上3300点整数关，以及重新站上半年线，那么未来迎来反弹的可能性还是比较大。毕竟，如果沪指再往下跌，就要考验年线的支撑了，昨天最低3254点，而年线就在3238点，已经很近了。　　另外，还有一点需要注意的是，近期港股市场也不太让人省心。昨天，A股好不容易有了止跌企稳的迹象，但港股市场又大跌了。恒生指数昨日下跌618点，收盘于28224.80点，跌幅高达2.14%。而恒生国企指数昨日更是大跌322.11点，以11162.58点报收，跌幅高达2.8%。　　港股市场后市如果持续调整的话，其实对于A股也会形成一定压力。所以，短期来看，即便短线有反弹，但还是要继续保持谨慎。如果沪指能够走出今年5月份那种双底形态，可能会更让人放心些。　　沪深300指数仓位参考　　昨日仓位：五成　　今日仓位计划：五成　　一、本仓位是结合趋势研究，设置的非实盘仓位参考，不作为买卖依据，请注意投资风险。　　二、本仓位跟踪标的为沪深300指数，以实现对指数量化跟踪，避免持仓个股差异影响效果。 　　根据国家有关部门的最新规定，本手记不涉及任何操作建议，入市风险自担。                                    (原标题：道达投资手记：后市反弹一触即发？)                                                (责任编辑：DF372)"
"郑眼看盘：风格暂切换 冲高宜减磅","摘要            本周一及周二权重股猛涨，小票猛跌，周三该局面出现明显转变，权重股开始补跌，而小票多数反弹。截至收盘，上证综指跌0.29%至3293.96点，深证综指涨0.68%至1879.65点。此外，中小板、创业板综指分别涨0.80%、1.54%。                             　　本周一及周二权重股猛涨，小票猛跌，周三该局面出现明显转变，权重股开始补跌，而小票多数反弹。截至收盘，上证综指跌0.29%至3293.96点，深证综指涨0.68%至1879.65点。此外，中小板、创业板综指分别涨0.80%、1.54%。　　对于这样的走势我并不觉得奇怪，即使如今市场理念已由投机开始转向投资，但也有一个反复与确认的过程。在A股市场，分红一向是不太多的，上市公司在利润调节及财务报表方面的工作均有待改进，在这种情况下想一下子扭转投资者的理念可能会比较困难。　　我昨天建议，投资者没有必要参与小票某日忽然出现的反弹。表面看上去，抢反弹很容易，可真正上手时就不是那么回事了，更何况还得提防周四可能的低开。当然了，如果有投资者自信有能力恰好于最低点买入，那就另当别论了。不过我觉得绝大多数投资者没这种功力，所以最合适的做法就是等待中线机会，而不是短炒。再者说，在下跌通道中参与短线炒作，能盈利基本上都是一时运气好，且盈利一般也不会太多。　　周三小票上涨除与技术形态过分超卖相关外，亦与权重股一开盘就猛跌相关。A股中权重股的杀跌可能还有个因素，这就是港股周三的大跌，恒生指数当天跌2.14%，恒生国企指数甚至跌去了2.80%。当港股杀跌时，带H股的A股往往就会承压。　　港股下跌与我国香港市场的利率上升相关，而这种上升又与美联储很可能在下周加息相关。就我国香港市场的金融机制来说，只要美国加息，其次日几乎一定会无条件跟进，否则要么是资金外流，要么是港币汇率无法咬住美元。　　对于港股的调整，投资者应认真对待，不能持惯常思维，认为调整后又会创新高。最起码，这次需要审视一下，待形势进一步明朗再说。以港股中的腾讯控股为例，该股走势一向稳健，可最近跌速却相对较快，这种情况在最近几年是较为少见的，理应引发投资者重视。　　如果港股市场继续走弱，这样A股中的小票也许还有些上行机会，但上行空间应相当有限，冲高一般应视为减磅机会。　　北京时间下周四凌晨，美联储应会宣布加息，这是个重要时间节点，不排除届时A股波幅放大的可能。不过，目前判断A股的涨跌依然比较困难，因美联储政策声明偏鹰偏鸽均有较大不确定性。                                    (原标题：郑眼看盘：风格暂切换 冲高宜减磅)                                                (责任编辑：DF372)"
"期指主力合约多数下跌 IF1712跌幅0.85%","　　期指主力合约12月6日多数下跌。其中，沪深300期指当月合约IF1712报收3988点，下跌34点，跌幅0.85%。成交量17224手，成交额206.14亿元，持仓27479手，较上一交易日减少349手。　　现货方面，沪深300指数报收4015.82点，下跌24.35点，跌幅0.6%。沪深300期指当月合约贴水27.82点，较上一交易日增加4.85点。　　上证50期指当月合约IH1712报收2867.4点，下跌40点，跌幅1.38%。成交量12403手，成交额107.12亿元，持仓16413手，较上一交易日减少179手。　　现货方面，上证50指数报收2875.73点，下跌34.75点，跌幅1.19%。上证50期指当月合约贴水8.33点，较上一交易日增加3.85点。　　中证500期指当月合约IC1712报收6132点，上涨39.2点，涨幅0.64%。成交量13550手，成交额165.06亿元，持仓22733手，较上一交易日减少247手。　　现货方面，中证500指数报收6172.8点，上涨39.89点，涨幅0.65%。中证500期指当月合约贴水40.8点，较上一交易日增加5.89点。                                            (责任编辑：DF064)"
