"标题","正文"
"期指小幅回升 延续高位震荡","　　据CME，截至7月23日，标普500(E-MINI S&P500)ESU8合约结算价报2812点，较前日上涨11.25点，涨幅0.4%，成交量802,099手，前一交易日未平仓数量2,691,633手。纳斯达克100(E-MINI NASDAQ100)NQU8合约结算价报7430.5点，较前日上涨70.5点，涨幅0.96%，成交量285,612手，前一交易日未平仓数量242,868手。道琼斯(E-MINI DOW)YMU8合约结算价25033点，较前日上涨3点，涨幅0.01%，成交量114,280手，前一交易日未平仓数90,100手。                                            (责任编辑：DF052)"
"概念股已蠢蠢欲动！股指期货即将恢复常态化？（附股）","摘要            【概念股已蠢蠢欲动！股指期货即将恢复常态化？（附股）】7月23日，证监会副主席方星海在期货公司高管人员培训班上表示，要促进金融期货发展，抓紧恢复股指期货常态化交易，满足境内外投资者股票市场风险管理需求；研究推出金融期货期权。                             最新价：10.00涨跌额：-0.39涨跌幅：-3.75%成交量：8万手成交额：8439万元换手率：2.41%市盈率：181.59总市值：34.43亿查询该股行情??实时资金流向??深度数据揭秘??进入中国中期吧??中国中期资金流相关股票飞力达(8.46 10.01%)长江投资(10.58 9.98%)中储股份(7.18 5.90%)保税科技(3.20 4.23%)相关板块参股期货(-0.77%)汽车行业(-1.04%)中字头(-1.14%)融资融券(-1.17%)最新价：5.91涨跌额：-0.01涨跌幅：-0.17%成交量：3万手成交额：2260万元换手率：1.06%查询该股行情??实时资金流向??深度数据揭秘??进入美尔雅吧??美尔雅资金流相关股票华升股份(4.48 10.07%)红豆股份(4.22 3.69%)德展健康(8.40 3.45%)天创时尚(9.24 3.24%)相关板块参股期货(-0.77%)汽车行业(-1.04%)中字头(-1.14%)融资融券(-1.17%)最新价：6.58涨跌额：-0.05涨跌幅：-0.75%成交量：6763手成交额：449万元换手率：0.27%查询该股行情??实时资金流向??深度数据揭秘??进入弘业股份吧??弘业股份资金流相关股票华升股份(4.48 10.07%)东方创业(11.64 7.28%)兰生股份(15.62 6.04%)汇鸿集团(4.49 4.91%)相关板块参股期货(-0.77%)汽车行业(-1.04%)中字头(-1.14%)融资融券(-1.17%)　　7月23日，期货概念异动走强，中国中期直线拉升封涨停，美尔雅快速拉升并涨停，弘业股份等涨幅逾5%。　　消息面上，7月23日，证监会副主席方星海在期货公司高管人员培训班上表示，要促进金融期货发展，抓紧恢复股指期货常态化交易，满足境内外投资者股票市场风险管理需求；研究推出金融期货期权。　　去年以来两次“松绑”　　股指期货的交易受限，需要回溯到2015年，当时市场大幅震荡，引发了股指期货“限空令”。2016 年，政策进一步收紧，中金所对股指期货实施了更为严格的限制。　　我国期货市场受监管影响较大，由于政策影响，股指期货成交量较以往出现巨幅下降。2016 年，金融期货市场累计成交量为0.18 亿手，累计成交额为18.22万亿元，同比下降94.62%和95.64%。金融期货产品中，沪深300、上证50、中证500 股指期货等主要品种的成交量较去年大幅下降98.48%、95.42%、84%。　　一系列收紧举措导致股指期货市场流动性骤然下跌，也引发了多起因流动性匮乏导致的“乌龙指”事件。　　因此，去年以来，中金所对股指期货临时性交易限制措施进行了两次“松绑”。　　1)第一次松绑：2017年2月16日　　中金所表示，在中国证监会统一部署下，中金所在综合评估市场风险、积极完善监管安排的基础上，按照“发挥功能、动态调整、加强监管、防范风险”的原则，决定稳妥有序地调整有关交易安排：　　一是自2017年2月17日起，将股指期货日内过度交易行为的监管标准从原先的10手调整为20手，套期保值交易开仓数量不受此限；　　二是自2017年2月17日结算时起，沪深300、上证50股指期货非套期保值交易保证金调整为20%，中证500股指期货非套期保值交易保证金调整为30%(三个产品套保持仓交易保证金维持20%不变)；　　三是自2017年2月17日起，将沪深300、上证50、中证500股指期货平今仓交易手续费调整为成交金额的万分之九点二。　　对于此次“松绑”，业内认为，调整风险可控，不会对股指期货和股票市场的正常运行产生过大冲击，但却迈出了循序渐进放开的第一步。更为重要的是，松绑反映出监管态度的边际趋暖，可以预期未来或将稳妥有序的恢复和完善功能，鼓励股指期货发挥积极作用。　　2)第二次松绑：2017年9月15日　　中金所在2017年9月15日宣布，自2017年9月18日(星期一)起，沪深300、上证50、中证500股指期货各合约平今仓交易手续费标准调整为成交金额的万分之六点九。此前，手续费标准是成交金额的万分之九点二。这意味着，交易手续费下调了25%。　　此外，沪深300和上证50股指期货各合约交易保证金标准，由当前合约价值的20%调整为15%，同样是自2017年9月18日起实施。保证金的下调幅度，同样是25%。　　对于这次调整，招商证券分析指出，虽然松绑力度温和，但对市场情绪和信心有的重要正面影响，彰显了监管对于市场的呵护之情，表明了鼓励股指期货以正确方式和合适速度发展的态度，后续一定会继续放松。另外，手续费与保证金的下调都将对投资收益产生直接利好。同时，市场流动性有望继续改善，相关对冲策略有望逐步恢复。　　流动性仍有待提升　　经过两次“松绑”以后，股指期货市场成交量、持仓量有所放大，期指贴水现指的情况有所转好，但股指期货市场仍然不能满足资产管理机构正常的风险管理和居民对财富保值增值的需要。　　因此，不少业内专家呼吁进一步“松绑”股指期货临时性交易限制措施，提高市场的流动性，使股指期货市场功能得以有效发挥，进而使资本市场运行更为平稳。　　中金所董事长胡政在今年5月的第十五届上海衍生品市场论坛上也介绍了股指期货市场的现状和发展计划。　　胡政指出，目前境内股指期货交易成本依然较高，市场流动性有待进一步提升，市场功能发挥受到一定限制，难以充分满足投资者风险管理的需求。从世界各国资本市场发展经验来看，股指期货是最基础、最成熟、交易最活跃的金融衍生品，是任何一个强大的资本市场都不可缺少的风险管理工具。　　参股期货的上市公司　　业内认为，期货板块对政策性利好的信息较为敏感，因此投资者可积极关注期货板块的表现。　　目前，期货公司按照股东类型大致可以分为证券系、实业集团系、银行系。其中，证券系和银行系期货公司的优势体现在流量优势，股票、债券市场经验。实业集团系期货公司(如中粮集团旗下的中粮期货)的优势体现在某些商品期货品种上，期货公司因为股东具有天然的持仓头寸，因此具有稳定的内生性业务需求。　　中银国际证券表示，根据期货公司2015 年的业绩表现，利润超过5000 万的上市公司中，除了12 家上市券商之外，只有华丽家族一家。另外，美尔雅、华丽家族、中国中期的期货业务净利润贡献超过上市公司净利润100%；大恒科技、云南铜业、弘业股份的期货业务净利润贡献超过10%；厦门国贸的期货业务净利润贡献约7.27%。　　中银国际证券指出，随着股市逐步回归正轨以及基差修复，股指期货的风险管理功能将会得到进一步认识，各类金融机构对股指期货的运用也将得到进一步提升，这对期货行业将是一个重大的利好。　　华泰证券表示，期货行业的建设持续完善，改革创新步伐领先的期货公司率先受益，关注期货相关标的：中国中期、弘业股份、厦门国贸、物产中大。此外股指期货功能恢复带来交易量上升，利好券商经纪、自营等业务发展，关注券商板块。　　官方声音>>>　　方星海：抓紧恢复股指期货常态化交易 研究推出金融期货期权　　相关报道>>>　　股指期货即将恢复常态化 密切关注时间表　　专家：股指期货交易限制进一步松绑可期　　股指期货或恢复常态化 细数期指规则过去                                            (责任编辑：DF207)"
"证券时报头版：恢复常态化让股指期货回归工具本质","摘要            【证券时报头版：恢复常态化让股指期货回归工具本质】证券时报头版刊文称，此次监管部门提出股指期货恢复常态化交易，但并未给出明确时间表，预计松绑力度肯定会大于去年。对于股指期货常态化，业内早有呼声，唯有恢复常态化，才能让股指期货回归其工具本质。当前，国内对于股指期货的认识更趋理性，期货市场价格信号通常领先于现货市场其实是好事，有利于资源配置效率的提高。健康的A股市场需要正常运行的股指期货。经过连续下跌，当前A股进入相对平稳运行状态，有了风险管理工具，各类长线资金入市积极性将进一步提高，各类资金活水将如期而至。同时，也有助于国内资本市场扩大对外开放，吸引更多海外机构参与。（证券时报）                             　　昨日，证监会副主席方星海在期货公司高管人员培训班开班仪式上提出，要抓紧恢复股指期货常态化交易。 　　恢复常态化，顾名思义，就是恢复到正常状态，意味着此前相对不正常的阶段将正式结束。这对国内资本市场无疑是非常积极的消息。　　国内首只股指期货产品——沪深300股指期货于2010年4月在中金所上市，至今已经8年多，加上2015年上市的上证50、中证500股指期货，国内已有三大股指期货品种。　　中金所股指期货上市后，股指期货在降低现货市场波动率和换手率方面都曾发挥积极作用。然而直到2015年7月，国内股市异常波动，迫于各方压力，中金所连续出台管控措施，在大幅提升交易保证金和手续费的同时，还将日内开仓交易量限制到了10手。　　之后，股指期货流动性骤降，市场几近“冰封”。去年2月和9月，虽然中金所对股指期货进行了两次松绑，但信号意义大于实质，其功能发挥仍然严重受限。　　此次监管部门提出股指期货恢复常态化交易，但并未给出明确时间表，预计松绑力度肯定会大于去年。股指期货的本质是风险管理工具，是成熟市场经济体不可或缺的金融衍生品品种。对于股指期货常态化，业内早有呼声，唯有恢复常态化，才能让股指期货回归其工具本质。　　一些个人投资者仍对股指期货心存疑虑，这更多是认识误区所致。历史已经多次验证，从长期来看，股指期货不会改变现货股票市场的走势，股市波动更多是受到经济形势、企业盈利变化等内在因素影响。　　往近了说，周一早市传出股指期货有望恢复常态的消息后，A股市场并未受到影响，午后继续震荡上行。再往远了看，回顾国内股指期货受限这两年多时间，A股持续走跌，与港股、美股市场迭创新高形成巨大反差。实际上，海外市场对股指期货曾经也有过质疑，可误解早已逐渐消除。　　当前，国内对于股指期货的认识更趋理性，期货市场价格信号通常领先于现货市场其实是好事，有利于资源配置效率的提高。　　健康的A股市场需要正常运行的股指期货。经过连续下跌，当前A股进入相对平稳运行状态，有了风险管理工具，各类长线资金入市积极性将进一步提高，各类资金活水将如期而至。同时，也有助于国内资本市场扩大对外开放，吸引更多海外机构参与。                                            (责任编辑：DF380)"
"抓紧恢复股指期货常态化交易 方星海未提具体时间表","　　7月23日，一则“证监会副主席方星海表态股指期货交易即将恢复常态”的消息在市场中迅速传开。晚间，证监会发布公告，详细讲述了此次会议的内容，其中公告提到，方星海表示，将抓紧恢复股指期货常态化交易。　　“方副主席只是说以后要放开股指期货，但谈得不多，根本没有提具体时间表。”参加了“2018年第一期期货公司董事长、总经理培训班”的北京一期货公司总经理向《每日经济新闻》记者表示。　　概念股因消息大涨　　7月23日，一则“证监会副主席方星海表态股指期货交易即将恢复常态”的消息在市场中迅速传开。该消息称，监管部门领导23日上午在2018年第一期期货公司董事长、总经理培训班上透露，股指期货交易即将恢复常态化，各家期货公司可以进行相关准备工作。　　受此影响，多只期货概念股盘中直线拉升，收盘时中国中期、美尔雅封住涨停，弘业股份、高新发展、厦门国贸等也纷纷大涨。　　7月23日晚间，证监会官网披露，中国期货业协会主办的期货公司高管人员培训班在北京举行，中国证监会副主席方星海出席开班仪式并讲话。　　对于下一步期货市场发展，方星海提出，首先，要坚守服务实体经济的根本宗旨不动摇。期货市场要发挥合理定价和风险管理的功能，促进经济高质量发展，提升资源配置效率。要平衡好市场活跃度与服务实体经济的关系，保持适度活跃和流动性，实现市场功能。其次，要加大业务、品种创新。持续推进品种创新，做精做细现有品种，着力解决好活跃合约不连续等影响实体企业风险管理效率的问题，提升产业客户、金融机构客户参与度。第三，持续促进期货市场国际化，推动解决政策、制度障碍，逐步使更多成熟品种国际化。第四，促进金融期货发展。抓紧恢复股指期货常态化交易，满足境内外投资者股票市场风险管理需求；研究推出金融期货期权；丰富国债期货品种，继续推动商业银行参与国债期货交易等工作。　　其中，关于股指期货证监会提了一句话：抓紧恢复股指期货常态化交易。　　事实上，股指期货交易受限，要追溯到2015年股市大波动时，当时中金所宣布了一系列限制举措。而因股指期货受限影响了功能发挥，在2017年，股指期货曾有过两次“松绑”。　　《每日经济新闻》记者注意到，自2018年以来，监管层也曾公开提到股指期货。在5月30日，中金所董事长胡政在第十五届上海衍生品市场论坛上也介绍了股指期货市场的现状和发展计划。而在今年6月14日，证监会副主席方星海在出席“2018陆家嘴论坛”期间提到，将创造条件允许境外投资者参与股指期货。　　并没有谈具体时间表　　对于证监会对股指期货的表态，深圳一期货公司副总对《每日经济新闻》记者表示，“据我了解，交易所一直在推动股指期货‘松绑’，证监会也同意了，但国务院还没有批复。监管层一直在说考虑放开，在加紧推动议程，但还没有具体的议程下来。”　　据了解，7月23日的培训会上，中国期货业协会王明伟会长主持了会议，证监会期货部、投保局、信息中心的相关负责同志参加了开班仪式，160名期货公司董事长和总经理参加了培训。　　“我们在会场，事实是没有外面说的那么夸张。证监会副主席方星海说我们要加入MSCI指数，引进外资，就必须要有对冲工具，要有足够的流动性。”参加了“2018年第一期期货公司董事长、总经理培训班”的北京一期货公司总经理向《每日经济新闻》记者表示，“证监会副主席方星海只是说以后要放开股指期货，但谈得不多，根本没有提具体的时间表，反正我是没有听到‘马上’‘立刻’这几个词的。”　　在很多市场人士看来，股指期货恢复常态交易的意义十分重大。　　上海申毅投资董事长申毅对媒体表示，股指期货的恢复不仅对期货行业甚至对整个资本市场是一个利好。　　在申毅看来，放开股指期货利好还表现在市场多了一个套保的工具，对投资来说更加有把握，市场会逐步企稳，改善市场的流动性。申毅预估，股指期货恢复常态后，可能法人户的交易量会更多，“产品户的交易量短期内增加不太现实。”                                            (责任编辑：DF387)"
"道达投资手记：医药股遭遇“踩踏” 无碍反弹行情延续","　　经过一个周末的消息发酵，昨天医药股遭遇重创，多只个股出现“一字板”跌停。不过，这并不影响整个市场延续反弹行情。截至收盘，上证指数大涨30.27点，以2859.54点报收，涨幅1.07%。　　值得注意的是，昨天盘中，消息面还传出一道利好消息，而这则消息，将会使得哪些板块从中受益？大盘已经收出两根中阳线，接下来的行情，是不是越来越值得期待？　　昨天集合竞价时段，一些医药股就被砸跌停，普利生物、康泰生物、长春高新、智飞生物、沃森生物、华兰生物等集体“躺下”。而此次事件的主角长生生物，昨天下午复牌也是封死跌停。　　对于医药股遭遇的“踩踏”，大家都是有预期的。达哥已经说过，短期这个板块肯定会受到冲击。不过，其他疫苗股是否存在错杀的可能，我觉得又要另当别论。疫苗行业不会因为出现了一个长生生物，导致整个产业停滞不前，甚至是被毁掉，相反，可能会因为此次事件而更受重视。　　这就好比2008年的三聚氰胺事件，并没有因为三鹿集团而导致整个产业垮掉。另外，三聚氰胺事件发生之后，反而令伊利和蒙牛成为乳业市场的龙头企业。要知道，当年伊利也曾经因为这个事件出现业绩亏损，但现在依然是行业龙头。此外，还有白酒行业的塑化剂事件，也一度冲击整个白酒股板块，但冲击之后，龙头依然是龙头。　　疫苗的问题，暂且不说了，再看看昨天的盘面。　　我曾在文章中说，上周五，关于资管新规的消息，引发了反弹行情的再次开启。银行、保险，信托，大金融板块成为市场最大的看点。而昨天，金融股依然对指数做出巨大贡献，成都银行连续第二个交易日涨停，工商银行继续大涨2.38%，其他银行股都集体上涨。　　除了大金融板块外，“中字头”个股也爆发行情，中国交建涨停，带动中国铁建、中国化学、中国铝业、中国中车等出现较大涨幅。另外，表现比较突出的还有水泥股、钢铁股等，这些都是受益于业绩因素。　　值得注意的是，昨天市场再次传出另外一个利好。　　据报道，人社部新闻发言人表示，到6月底，全国已经有14个省(区、市)与社会保险基金理事会签署了委托投资合同，目前合同的总金额是5850亿元，其中3716.5亿元资金已经到账并开始投资，其他资金将按合同约定分年分批到位。从投资运营情况看，2017年投资收益率是5.23%。此外，上海还准备追加委托投资300亿元，四川准备委托投资1000亿元，正在与全国社保基金理事会商洽签署投资合同。　　这部分养老金开始到位并进行投资，其中必然有部分会流入A股市场。如果从到账的时间点来看，入市的点位大概就是沪指2800点附近。此前，我曾经说过，大盘跌到这个位置，已经是进入“估值底”区域，在这个区域，其实就是适合这一类长期投资的资金。这类资金进入市场后，最为青睐的个股，一是绝对的低估值，另外就是高分红，只要派息率具有吸引力，就会是长线投资资金买入的对象。　　对于后市，我继续维持相对乐观。经过上周五和昨日的上涨，大盘连续收出两根具有较长实体的阳线，同时昨日成交量有所放大，沪市成交1870亿元，说明市场信心正在逐渐恢复过程中。　　沪深300指数仓位参考　　昨日仓位：五成　　今日仓位计划：五成　　一、本仓位是结合趋势研究，设置的非实盘仓位参考，不作为买卖依据，请注意投资风险。　　二、本仓位跟踪标的为沪深300指数，以实现对指数量化跟踪，避免持仓个股差异影响效果。                                            (责任编辑：DF387)"
"股指期货恢复常态是好事","　　7月23日，有媒体报道称，股指期货交易即将恢复常态化。本栏认为，股指期货要恢复常态是一件很好的事情，不仅有利于投资者，而且对于A股的国际化意义也十分重大。　　经典证券理论说，没有对冲的单纯持股就像是“裸奔”。通俗的意思就是，如果投资者看好一家公司，那么他最正确的做法不是单纯地买入公司股票并持有，而是在买入这家公司股票的同时，做空股指期货过滤掉系统性风险，这样一来，这名投资者就能够获得单纯的公司经营良好获得的股价上涨，而不必承担股价下跌的风险。　　当然，过滤系统性风险的方法有很多种，除了股指期货之外，还有股票期权、可转换债券、卖空同行业其他公司等。然而，相比之下，股指期货是最直接、流动性最好的选择。　　股指期货要放开的消息在市场上曾出现过几次，但后来都不了了之。然而，本栏认为，本次放开的消息与以往有很大的不同，最终也很可能让股指期货恢复常态。其中，最大的不同之处在于A股正式加入了MSCI指数。而境外基金经理在选择A股股票的时候，必然要考虑进行套期保值交易，如果A股股指期货不恢复常态，那么不排除新加坡在A50指数期货之后再推出一个MSCI指数期货，这样当境外基金经理纷纷选择新加坡作为套期保值地时，A股市场的国际化又将失去先机。　　所以在本栏看来，A股股指期货尽快恢复常态，不仅有利于A股投资者，而且对于A股国际化也具有重要的意义。　　此外，A股股指期货恢复常态化，另外一个重要意义还在于可以活跃市场。现在股指期货保证金率不是很高，20手的交易限制对于大多数散户投资者来说也还能接受。因而，本栏认为首先应该取消的是每笔1元的报单费和当日平仓的惩罚性手续费。虽然说1元不算多，但这毕竟让投资者下单趋于谨慎，能不下的单就不下，能不撤的单就不撤，没有了活跃的报单，价格波动的频次也会下降，这对于股指期货活跃是不利的。　　如果管理层认为报单费可以抑制程序化交易的高频交易，那么不妨规定每个账户每天前10笔报单免费，后面才开始收费，这样也能起到为散户“松绑”的作用。　　有了散户的高频次交易，股指期货市场将趋于活跃，这样也就具备了未来承接较大套期保值压力的能力。这无论是对于A股市场还是股指期货市场，都是好事。　　不过，虽然股指期货交易恢复常态化是好事一桩，但也不能盲目。正如证监会副主席方星海所说，“有个前提，需要等待合适的时机和成熟的条件”。                                            (责任编辑：DF372)"
