"标题","正文"
"供应充足 油脂期价仍将承压","　　昨日，国内三大油脂期货集体跳水，其中菜油期货主力1809合约跌幅逾2%，领跌油脂。分析人士表示，前期菜油价格大涨，令需求受到抑制，叠加交易商因加拿大菜油利润高企抛售国内菜油期货等因素，期价走势承压。中长期来看，全球油脂供给依然过剩，在此背景下，油脂期货恐将继续承压。　　菜油期货领跌油脂　　周二，国内三大油脂期货走势疲软，其中菜油期货主力1809合约盘中遭遇多头疯狂减仓，一度逼近跌停，最低至6696元/吨，盘终收报6818元/吨，跌155元或2.22%，创下“四连阴”；棕榈油期货紧随其后，主力1809合约盘中亦创下近一月低位，最终收报5044元/吨，跌78元或1.52%；豆油期货主力1809合约收报2045元/吨，跌24.5元或1.18%。　　伴随着期货价格走软，前期炒作的资金也加速离场。截至昨日收盘，菜籽油、棕榈油、豆油期货主力合约分别减仓63674手、34276手、42342手。　　“菜油价格大幅拉升之后，需求已经受到严重抑制，引发库存开始回升。另外，菜油价格大幅飙升之后，加拿大菜油进口利润较好，交易商开始买加拿大菜油抛售国内菜油期货，也打压了菜油期价走势。再加上缺乏资金的进一步助推下，菜油期价滞涨大幅回落，并领跌油脂期货。”弘业期货分析师徐海峰表示。 　　华泰期货分析师范红军表示，终端市场对当前菜油价格认可度不是很高，贸易商也基本停止采购，下游需求较差，且三大油脂库存水平很高。总体来看，现阶段油脂期价上涨趋势较难延续，难有太大上涨空间。　　供需格局仍显宽松　　对于后市，中信期货分析师表示，斋月备货结束，马来西亚棕榈油出口需求放缓，且马来西亚棕榈油仍处于增产周期，中长期将施压油脂市场。国内市场来看，上游供应端，棕榈油库存趋增，豆油库存小幅回升，油脂整体供应仍充足。下游消费端，当前豆棕价差缩窄，棕榈油市场清淡，豆油成交相对较好，油脂消费季节性转淡。综合来看，油脂供需格局仍显宽松。　　不仅如此，据天下粮仓最新预测数据显示，5月份国内各港口进口大豆预报到港141船904.2万吨，6月份大豆到港最新预期在950万吨，7月份最新预期1000万吨，8月份初步预估860万吨。到港量的巨大对油粕在近月的压力依然不小。　　南华期货研究所分析师表示，中长期而言，全球油脂供给依然过剩，尤其是马来西亚和印尼棕榈油增产使得全年供给宽松，且弱拉尼娜天气更是有望促进棕榈油增产。此外，6月国产菜籽即将大量上市，届时供给紧蹙的利好将不复存在。且国内豆油库存处于8年高位，近期仍有抬头之势。                                            (责任编辑：DF155)"
"菜粕菜油期价双跌 菜油粕夜盘可能回调寻支撑","　　国外盘面：周二，洲际交易所(ICE)旗下的加拿大温尼伯商品交易所油菜籽期货成交冷清，截至15:21分，05合约报528.5加元/吨，跌2.1元/吨，跌幅0.4%；07合约报523.9加元/吨，跌1.4加元，跌幅0.27%；11合约报515.8加元/吨，跌1.9加元，跌幅0.37%。　　国内盘面：6月5日，菜籽1809合约交易冷清，不宜操作。菜粕1809合约收报2480元/吨，较前一交易日结算价下跌19元/吨，跌幅0.76%。菜油1809合约收报6818元/吨，较前一交易日结算价跌155元/吨，跌幅2.22%。　　消息面：华盛顿4月20日消息：美国农业部海外农业局发布的参赞报告显示，2018/19年度中国油菜籽播种面积预计为为710万公顷，比当前年度减少1%。基于正常单产，中国油菜籽产量预计为1410万吨，比当前年度减少1.4%。 　　现货方面：根据天下粮仓数据，6月5日，进口菜油(含进口菜籽压榨)现货报价6615元/吨，菜粕现货报价2389元/吨。 　　小结：根据商务部数据，预报下期(5月1日至15日)菜籽进口到港数量26.8万吨，预报5月进口到港数量为34.6万吨，环比4月进口量增加42.4%。菜籽油厂开机率和入榨量双回升，截止5月25日开机率回升至20.6%，上周开机率13%；周度油厂压榨量由6.5万吨上升至10.2万吨，涨幅57%；尽管菜粕期现价格依然弱势但由于油厂压榨利润可观，激发了油厂开机压榨积极性。 　　菜油方面：根据布瑞克最新数据油菜籽沿海库存由上期的42.7万吨下降至35.5万吨，其中广东和福建地区库存降幅显著；6月1日加拿大菜籽进口完税成本报3835元/吨，较1日下调2元/吨；6月4日6月加拿大菜油进口完税成本报6621元/吨，并且6月加拿大进口菜油郑盘套保利润由5月31日的216元/吨下降为6月1日的104元/吨，随着菜油1809合约期价走低，预计套保空间将逐渐被市场消化。近期1809合约菜油与替代品豆油、棕榈油合约价差过大，替代效应将显现，不利于菜油消费。 　　菜粕方面：根据布瑞克最新数据，两广福建地区菜粕库存减少0.1万吨，未执行合同减少0.3万吨；但由于油厂周度压榨量由上期6.5万吨飙升至10.2万吨，预计近期菜粕库存应有增加，对期价形成利空。替代品方面，根据美国农业部(USDA)5月份供需报告，由于巴西大豆增产幅度大于阿根廷减产幅度，2017/18年度全球大豆库存比4月数据调增136万吨，利空豆粕菜粕。 　　操作建议：技术上，菜籽1809合约交投清淡，不建议交易；操作上，菜粕1809合约夜盘可能偏弱震荡，再度测试2463元/吨支撑；菜油1809合约夜盘可能回测6763元/吨支撑。                                            (责任编辑：DF318)"
"菜籽油：预计后市偏强震荡","　　1、基本面： MPOB显示马棕库存低于预期，5月份产量减少，但船调机构显示马棕出口数据较同期下降8.8%，需求前景疲弱，预计反弹承压；国内库存压力改善，供应不缺。 偏空 　　2、基差：菜籽油现货6850，基差-99，现货贴水期货。偏空 　　3、库存： 5月25日菜籽油商业库存29万吨，前值29万吨，环比+0万吨，同比-32% 。偏多  　　4、盘面：期价运行在20日均线上，20日均线朝上。偏多 　　5、主力持仓：菜籽油主力减空。偏空 　　6、结论：不宜过分看多，预计偏强震荡，具体需关注中美双方进一步动向。菜油OI1809:6900附近或以下多单入场，止损6800，轻仓操作                                            (责任编辑：DF318)"
"菜油上涨不会一蹴而就","　　5月下旬以来，菜油期货增仓上行。目前，主力1809合约涨至7000元/吨，盘面抛压增强。 　　临储菜油剩余量已经不多 　　2014/2015年度，临储菜油库存一度超过560万吨。随后，国家启动拍卖。在2018年年初拍卖20万吨、定向销售90万吨之后，目前临储菜油库存只剩15万吨，剩余量已经不多。 　　国产菜籽产量持续下降 　　受种植收益相对较低的影响，近几年国产菜籽产量持续下降，国产菜油产量也随之下降。相关机构的统计数据显示，2014/2015年度，国内菜籽产量达到607万吨，而到2017/2018年度，已经降至340万吨。按照20%的降幅估算，2018/2019年度国内菜籽产量将降至270万吨。除去种用损耗，预计2018/2019年度国产菜籽折油在93万吨。 　　加拿大菜籽产量预计下滑 　　在国产菜油产量下降的背景下，国内市场的进口依赖度增强。菜油进口主要有两个来源，一是进口菜籽之后压榨成菜油；二是进口毛菜油。目前，加拿大是我国进口菜籽及毛菜油的主要来源国，预计2018/2019年度国内将进口加拿大菜籽450万吨。按照进口菜籽出油率43%折算，进口菜籽折油194万吨。同时，预计毛菜油进口量将增加至100万吨。 　　受土地面积和菜籽压榨产能限制，加拿大菜籽和菜油产量近几年平稳增长，出口量难以出现较大幅度的增加。从种植意向来看，2018/2019年度，加拿大菜籽种植面积将减少7%。尽管市场对此数据存怀疑态度，但部分机构已经下调2018/2019年度加拿大菜籽产量至2110万吨，较上年度减少1.86%。另外，前期加拿大菜籽产区偏干旱，市场担忧菜籽供应紧张。2018年上半年，毛菜油进口利润较好，国内贸易商进口积极，毛菜油进口量增加，而受出口能力限制，加拿大对我国出口100万吨毛菜油已是上限。 　　菜油消费相对稳定 　　菜油消费主要有三个渠道：餐饮、食品和家庭消费。小包装菜油主要针对家庭消费，中包装菜油主要面向餐饮，散油则面向餐饮和食品厂。小包装菜油需求相对刚性，注重口感的地区对浓香型四级菜油也有刚需，而中包装和散油中，菜油和其他植物油存在一定的替代效应。近几年，菜油消费相对稳定，2017/2018年度，国内菜油消费量为530万吨，考虑到菜油价格上涨后的替代消费，预计2018/2019年度，消费量在460万吨。 　　棕榈油和豆油基本面疲弱 　　棕榈油是全球贸易量最大的植物油脂。2016年，受厄尔尼诺影响，印度尼西亚和马来西亚棕榈油产量萎缩；2017年，产量开始恢复；2018年，虽然产量增幅放缓，但仍处于增产周期。而需求端，最大进口国印度提高棕榈油进口关税至10年来的最高水平。豆油作为大豆压榨的附属品，近几年，受国内大豆进口量持续增加影响，豆油库存被动增加。目前，国内豆油商业库存为132万吨，处于历史同期偏高水平，较去年同期增加9.54%。 　　中长期来看，菜油存在供应缺口，以至于近两周菜油期货持续增仓，资金做多意愿较强；短期来看，现货需求较差、套保盘入场等因素打压盘面，多空分歧加大，盘中波动加剧。预计菜油期价的上涨不会一蹴而就，趋势性行情需要现货和其他油脂的配合。操作上，建议逢回调买入，分批入场，中长期持有。 　　(作者单位：国泰君安期货)                                            (责任编辑：DF318)"
"菜粕菜油期价双跌 菜粕菜油空单持仓中","　　国外盘面：周五，洲际交易所(ICE)旗下的加拿大温尼伯商品交易所油菜籽期货成交冷清，截至15:12分，05合约无成交；07合约报533.3加元/吨，跌0.8加元，跌幅0.15%；11合约报522.5加元/吨，跌1.5加元，跌幅0.29%。　　国内盘面：6月1日，菜籽1809合约交易冷清，不宜操作。菜粕1809合约收报2498元/吨，较前一交易日结算价下跌9元/吨，跌幅0.36%。菜油1809合约收报6949元/吨，较前一交易日结算价跌81元/吨，跌幅1.15%。　　消息面：华盛顿4月20日消息：美国农业部海外农业局发布的参赞报告显示，2018/19年度中国油菜籽播种面积预计为为710万公顷，比当前年度减少1%。基于正常单产，中国油菜籽产量预计为1410万吨，比当前年度减少1.4%。　　现货方面：根据天下粮仓数据，6月1日，进口菜油(含进口菜籽压榨)现货报价6768元/吨，菜粕现货报价2407元/吨。　　小结：根据商务部数据，预报下期(5月1日至15日)菜籽进口到港数量26.8万吨，预报5月进口到港数量为34.6万吨，环比4月进口量增加42.4%。菜籽油厂开机率和入榨量双回升，截止5月25日开机率回升至20.6%，上周开机率13%；周度油厂压榨量由6.5万吨上升至10.2万吨，涨幅57%；尽管菜粕期现价格依然弱势但由于油厂压榨利润可观，激发了油厂开机压榨积极性。　　菜油方面：根据布瑞克最新数据油菜籽沿海库存由上期的42.7万吨下降至35.5万吨，其中广东和福建地区库存降幅显著；6月1日加拿大菜籽进口完税成本报3833元/吨，较31日下调73元/吨；5月31日6月加拿大菜油进口完税成本报6618元/吨，并且6月加拿大进口菜油郑盘套保利润高达216元/吨，当前期价给出了直接进口加拿大菜油的利润空间，利空菜油1809合约。并且近期1809合约菜油与替代品豆油、棕榈油合约价差过大，替代效应将显现，不利于菜油消费。　　菜粕方面：根据布瑞克最新数据，两广福建地区菜粕库存减少0.1万吨，未执行合同减少0.3万吨；但由于油厂周度压榨量由上期6.5万吨飙升至10.2万吨，预计近期菜粕库存应有增加，对期价形成利空。替代品方面，根据美国农业部(USDA)5月份供需报告，由于巴西大豆增产幅度大于阿根廷减产幅度，2017/18年度全球大豆库存比4月数据调增136万吨，利空豆粕菜粕。　　操作建议：技术上，菜籽1809合约交投清淡，不建议交易；操作上，菜粕1809合约早评建议期价不能站上2520元/吨短空，空单可继续持有，短期止盈目标2470元/吨；菜油1809合约早评建议期价上冲7000元/吨压力位失败则进空，空单夜盘如下破6940元/吨则继续持有，下破失败建议先止盈。                                            (责任编辑：DF318)"
"菜油仍有上涨空间","　　消费旺季逐渐临近 　　5月下旬以来，随着临储菜油陆续出库，潜在供应压力减轻，加之商业库存同样偏低，而菜油需求呈现刚性，供给偏紧的菜油期货在油脂板块中率先发力，强劲上行，突破3个月低位盘整区间。展望后市，菜油供应有限，而下半年需求旺季逐渐临近，菜油期货仍有上涨空间。 　　新作菜籽价格稳中有涨 　　5月中下旬以来，从云南、贵州开始，至长江中下游地区，我国夏收油菜籽陆续收获上市。由于播种面积下降，今年夏收油菜籽产量下降已成定局。和政府机构预计数字不同，市场预计今年国内油菜籽产量在500万吨以下。国产油菜籽的非转基因性质使其绝大多数被用来生产小机榨菜油，售价在13000元/吨以上，对进口菜油价格不仅不会造成冲击，而且会因进口菜油可以掺入国产菜油销售，对进口菜油价格带来提振作用。 　　国产新作菜籽上市后，随着水分的降低，加之农民因减产惜售，油菜籽价格高开高走，稳步上行。据监测，在湖南地区，国产新作油菜籽价格从最初上市的2.35元/斤左右上涨至目前的2.45元/斤左右。油菜籽价格走强利多菜油价格。 　　临储抛售行将结束 　　从2015年年底至今年春节前，政府持续抛售和定向销售前几年积累的庞大菜油临储库存，至今年上半年，最后一批临储菜油将出库完毕，长时间悬在菜油市场头顶的供应“堰塞湖”成功泄洪。而且目前流向市场的临储菜油为非转基因国产菜油，多被企业灌装成小包装油销售，对菜油市场冲击力度有限。 　　另外，没有了前两年临储菜油源源不断流向市场，目前的菜油商业库存和往年比也大为下降。据监测，截至5月25日，华南地区(两广、福建)油厂菜油库存为6.25万吨，较去年同期的11.31万吨下降44.74%；华东地区(江苏、安徽、上海)油厂菜油库存为22.79万吨，较去年同期的31.56万吨下降27.79%。 　　加拿大菜籽播种面积下降 　　临储菜油抛售结束后，我国菜油供应的主要来源就是国产油菜籽压榨和进口油菜籽压榨、进口菜油。由于种植效益偏低，国产油菜籽很难增产，而且多用于生产小机榨菜油，对普通菜油冲击不大。而进口油菜籽和菜油受国际贸易总量限制，大幅增加的概率也不大。今年我国最主要的油菜籽和菜油进口来源国——加拿大的油菜籽播种面积可能下降，对我国进口油菜籽和菜油将带来不利影响。据加拿大统计局数字，加拿大2018年油菜籽播种面积将为2140万英亩，比上年的2299.7万英亩减少7%。 　　相关油脂库存下降 　　由于需求上可以相互替代，菜油很难完全摆脱豆油和棕榈油的影响。今年以来菜油走势偏弱很大程度是受到豆油和棕榈油这两个“猪队友”的拖累。但最近这两个油脂品种库存开始下降，有望伴随着菜油“一起飞”。据监测，截至5月25日，港口棕榈油库存为63.5万吨，比4月中旬高点的73.38万吨下降13.46%。豆油库存为132万吨，比年初的160万吨下降17.5%。而且6月将在青岛召开上合组织峰会，青岛周边地区油厂将停产近两周时间，豆油库存还有进一步下降的空间。 　　综上所述，美豆价格上行，利多菜油。菜油库存下降，营造强势氛围。技术上看，菜油期货突破刚刚完成，仍有上涨空间。 　　(作者单位：金期投资)                                            (责任编辑：DF318)"
"农产品接连发力之菜油：菜油走势分析","　　农产品期货接连发力 　　下图是文华财经农产品指数的长期走势，我们认为大级别上农产品的拐点，已经在16年2月份产生了，基于，从历史上来看，大级别上的拐点工业品和农产品是比较一致的，而工业品基本已经能够确认在15年底16年初已经完成筑底。 　　下图是文华财经工业品指数长周期走势。 　　短期来看，从18年2月初至今，农产品指数出现连续上涨，目前已经快要突破16年12月底的高点位置。在此期间，农产品各个品种之间的走势是有分化的，呈现热点轮动状态，最先上涨的是豆粕，随后是苹果、棉花，从5月初启动上涨至今的菜油，成为整个农产品板块持续轮动的新增品种，主力合约至今日盘中最高价，上涨了大约10%。 　　菜油走势分析 　　当前的菜油交易的并非是一个一致预期的基本面，这和今年交易阿根廷减产时期的豆粕是不一样的。本文以中立的立场，尽量客观的分析当前菜油供需的多空状态。 　　目前菜油期货总持仓为75.6万手(双边)，已经创历史新高，增仓和价格上涨的阶段是匹配的，5月期间持仓增加了34.7万手。持仓如此大幅的增加，资金肯定有其推涨的理由，并且在这个阶段，空头并没有办法证伪。 　　下面是我们分析资金推涨菜油的理由(仅代表作者观点，不代表资金观点)。 　　首先从上文我们分析的农产品板块持续轮动出发，资金可能在全面配置农产品，农产品中比较有题材的品种成为资金炒作的标的，豆粕、苹果、棉花等都是从供需上能够找到做多的题材。 　　其次，远期菜油供应有限，具备做多的基础。 　　第三，国际市场上，生物柴油前景存在良好预期，根据油世界的观点，印尼的棕榈油生柴用量可能增加100万吨，因利润改善以及政策支持，如果印尼能实现100万吨的增量，棕榈油平衡表将出现很大改善。原油价格走势对美国生柴掺混利润以及印尼生柴利润改善都至关重要，而目前原油价格是存在继续走高的可能性的。 　　第四，国际豆油供需整体处于平衡，但如果美国这一季大豆减产，这种平衡性将会被打破。 　　下面是我们分析空头看空菜油的理由(仅代表作者观点，不代表资金观点)。 　　首先，国际市场上，产地棕榈油的供应压力依然存在，未来还是去库存为基调，国内市场上，整体油脂还是大库存，因此当下并不具备趋势上涨的基础。 　　第二，具体到菜油而言，定向菜油出库、上涨过程中成交平淡、基差很弱，这些指标都说明菜油现货端还面临较大压力。 　　下面我们分析一下，远期菜油供需是否真的会紧张。 　　拍卖菜油被消化之后，国内菜油供应有限，国内能提供的供应只能依赖国产菜籽，并且国产菜籽产量有限，按照300万吨预估，折油约110万吨，剩余的部分都需要进口菜籽或者进口菜油来满足。 　　因此远期菜油是否会面临缺口实际上需要评估两个问题： 　　一是国内菜油一年的消费量需要多少？ 　　二是能够从国际市场进口多少菜籽和菜油？ 　　理论上我们可以从加拿大进口很多菜籽和菜油，但如果需要的进口量远远超过了往年的量，才能满足国内总需求，就会抬高进口成本，一样的也会抬高价格。 　　历史上，国内菜油消费最低的年份在11/12、12/13、13/14年，我们统计的这三年的消费量在380万吨左右每年。如果按照最低380万吨消费去测算，国内菜籽折油110万吨，则需要进口菜籽折油和进口菜油至少270万吨。 　　按照年消费量450万吨测算(历史上05/06-07/08以及10/11、14/15年年消费量大约450万吨)，则需要进口菜籽折油和进口菜油340万吨。 　　按照年消费量500万吨测算，则需要进口菜籽折油和进口菜油390万吨。 　　如果下一年度加拿大菜籽产量不大幅增加(按照目前加拿大统计局的预估，18/19年产量增40万吨)，中国从加拿大进口菜籽折油和进口菜油超过330万吨(按照500万吨菜籽和120万吨菜油计算)，则可能会造成其他产地供应的紧张，从而抬高进口成本。 　　因此450万吨以下的消费量可能意味着宽松、而以上的消费量则可能意味着库存趋紧。而较低的消费则需要较高的价差来配合，历史上菜豆价差出现过2500左右的极值，可能对应的是380万吨左右的消费。当然当年和今年的宏观环境、绝对价格存在差异，因此在比较的时候需要注意。 　　多空交织，预期和当下的矛盾如何解决？ 　　菜油供需上面，预期和当下的矛盾客观存在，菜油持续给出进口利润，也在给空头加码。但真正到交割环节，09合约、01合约是否会有大量交割是解决这个矛盾的关键，这取决于符合菜油交割品质的菜油供应以及基差表现，目前还不明朗。                                            (责任编辑：DF318)"
"豆菜油走势缘何出现严重分化？","　　上周油脂市场掀起了一波小牛市，然而主角不是大宗的豆油，而是躲在角落里的菜油，菜油的发力似乎不知不觉，仔细想想也在情理之中。可以明显看出两个油脂不同的走向，一个明显走牛了，另一个还在底部震荡，究其原因，有很多因素，在分析油脂的时候我们很多时候会在一块去分析，一个上天堂，一个下地狱的情况很少发生，然而现在这个状况的确发生了。　　首先，第一个，库存的差异，豆油库存依旧在130万吨上下。　　菜油哪，本周华东、华南菜油总库存27.3万吨，较上周减少0.96万吨。其中华东较前一周减少0.43万吨，华南减少0.53万吨。上月同期库存26.89万吨，去年同期库存39.63万吨。　　由库存数据可见，菜油库存大概是豆油库存的零头多一点，有人讲你不能这么比较，豆油库存一直比菜油库存低吗？那么就从去年同期来讲，豆油库存是100万吨下面的，而菜油还比去年库存还低，强弱可见一斑。其中一个原因是去年全球大豆(3716， 11.00， 0.30%)丰产形成的后遗症，巨量的库存短期消化速度难以抵消。　　还有一个重要的因素：观念，目前的健康观念慢慢的在国人心中上升到了一定高度，有关转基因危害的文章一篇接着一篇，转基因大豆混入非转基因大豆的报道也比比皆是，在“李逵”和“李鬼”傻傻分不清楚的情况下，豆油被贴上的不好的标签，于是豆油在普通家庭的消费比开始逐渐下降。其实客观来说，菜油也是有转基因的，加拿大也是世界上转基因油菜籽种植面积超过2/3的国家。加拿大培育了很多转基因油菜籽，中国进口的也大多为转基因菜籽，当然，国储里的菜油基本都是非转的，虽然之前流传过转基因菜油流进国储的情况，但是菜油情况还是好于豆油，毕竟量小嘛，而且目前国家对这块抓的很严，所以菜油相对“纯洁”。 　　有人讲，豆油菜油价差还会继续扩大吗？ 　　豆菜差价 　　目前来看，差价继续往上的概率是大的，有人讲，最大能扩大为多少，历史上就我所知的差价有到过2500的，所以现在这个差价并不是终点。　　到这里就有人问了，豆油啥时候才能起来啊？库存降到100万吨以下的时候，现在多少？130万，加上近期压榨走高和消费低迷，豆油库存还能不能继续下需要打上个问号，豆油上涨的日期也无法去推测，如果在10月前面库存依旧高企，那么豆油上涨就是遥遥无期了。　　当然，我知道很多人对于豆油上涨很期待，但是客观事实也要客观面对，豆粕(3049， -11.00， -0.36%)三季度是传统旺季，如果需求起来库存是会在很短时间被消化的，然而豆油是持续了近一年了高库存，什么时候能涨我也不清楚，你的观点哪？                                            (责任编辑：DF318)"
